Номер;Тип;Площадка;Срок;Начало аукциона;Заказчик\Владелец;Название;Регион;Цена лота;Победитель;Цена победителя;% изменения цены;Обеспечение заявки;Обеспечение контракта;Ежемесячная аб.плата;Срок контракта
31807221713;Закупка 223-ФЗ;ЗАО «Сбербанк-АСТ»;17.12.2018 в 10:00;10.01.2019 в 18:00;АО «Связьтранснефть», г. Волгоград; 37-03/ДКО-СВПТУС-05.2019 «Предоставление канала связи», 50  Мбит/с. Наша цена — 1 739880,00 руб.;"Адреса точек окончания каналов: 
Точка А:   г. Волгоград, ул. Электролесовская, д.15
Точка Б:   г. Волгоград, ул. Рабоче-Крестьянская, д.67 ";2 371 200,00;АО «Квантум»;1 739 880,00;26,62%;5500,00;0,00;28 998,00;60 мес
0311100001318000295;Закупка 44-ФЗ;АГЗ РТ;26.12.2018 в 08:00;29.12.2018 в 11:05;Управление Федеральной службы исполнения наказаний по Республике Татарстан, г. Казань;Оказание телематических услуг связи по предоставлению доступа к сети Интернет. Наша цена — 380 160,00 руб.;9 точек по Республике Татарстан -  2 Мбит/с.;475 200,00;ПАО «Таттелеком»;377 784,00;20,00%;0,00;23760,00;34 344,00;11 мес
0311100001318000294;Закупка 44-ФЗ;АГЗ РТ;26.12.2018 в 08:00;29.12.2018 в 10:25;Управление Федеральной службы исполнения наказаний по Республике Татарстан, г. Казань;"Оказание телематических услуг связи по предоставлению  доступа к сети ""Интернет"". Наша цена — 1 206480,00 руб.";22 точки по Республике Татарстан — 4 Мбит/с — 21 точка, 40 Мбит/с — 1 адрес.;1 508 100,00;ПАО «Таттелеком»;1 198 939,50;20,00%;15081,00;75405,00;108 994,50;11 мес
0111200004018000189;Закупка 44-ФЗ;АГЗ РТ;27.12.2018 в 08:00;09.01.2019 в 09:50;Министерство информатизации и связи Республики Татарстан, г. Казань;Предоставление канала связи IP VPN в рамках развития многофункциональных центров предоставления государственных и муниципальных услуг, 100 Мбит/с. Наша цена — 562 650,00 руб.;"Точка А: г. Казань, ул. Можайского, д.6; Точка Б: г. Казань, ул. Петербургская, д.52";726 000,00;ПАО «Ростелеком»;559 020,00;23,00%;0,00;36300,00;50 820,00;11 мес
0832200000118000237;Закупка 44-ФЗ;ЭТП НЭП;27.12.2018 в 09:00;09.01.2019 в 11:30;ГКУ Нижегородской области «Управление по делам гражданской обороны, чрезвычайным ситуациям и пожарной безопасности Нижегородской области», г. Нижний Новгород;Услуги по предоставлению канала доступа к виртуальным частным cетям (VPN), 1 Мбит/с. Наша цена — 23 600,00 руб.;Нижегородская область, Семеновский р-он, п. Беласовка, ул. Верхняя, д.85 Б;110 000,00;ПАО «Ростелеком»;23 050,00;79,05%;0,00;27500,00;2 095,45;11 мес
0832200000118000238;Закупка 44-ФЗ;ЭТП НЭП;27.12.2018 в 09:00;09.01.2019 в 09:00;ГКУ Нижегородской области «Управление по делам гражданской обороны, чрезвычайным ситуациям и пожарной безопасности Нижегородской области», г. Нижний Новгород;Услуги по доступу к информационно-коммуникационной сети Интернет, 1 Мбит/с. Наша цена  -24 453,00 руб.;Нижегородская область, р.п. Воротынец, пер. Строителей, д.9;28 600,00;АО «Квантум»;24 453,00;14,50%;0,00;7150,00;2 223,00;11 мес
0832200000118000239;Закупка 44-ФЗ;ЭТП НЭП;27.12.2018 в 09:00;09.01.2019 в 11:30;ГКУ Нижегородской области «Управление по делам гражданской обороны, чрезвычайным ситуациям и пожарной безопасности Нижегородской области», г. Нижний Новгород;Услуги по доступу к информационно-коммуникационной сети Интернет, 1 Мбит/с. Наша цена — 14 200,00 руб.;г. Нижний Новгород, ул. Культуры, д.100;16 500,00;ПАО «Ростелеком»;14 100,00;14,55%;0,00;4125,00;1 281,82;11 мес
0832200000118000241;Закупка 44-ФЗ;ЭТП НЭП;27.12.2018 в 09:00;09.01.2019 в 09:00;ГКУ Нижегородской области «Управление по делам гражданской обороны, чрезвычайным ситуациям и пожарной безопасности Нижегородской области», г. Нижний Новгород;Услуги по предоставлению канала доступа к виртуальным частным сетям (VPN), 1 Мбит/с. Наша цена — 14 294,50 руб.;г. Нижний Новгород, ул. Ванеева, д.205;25 300,00;ПАО «Мегафон»;13 915,00;45,00%;0,00;6325,00;1 265,00;11 мес
0372200127618000129;Закупка 44-ФЗ;ЗАО «Сбербанк-АСТ»;26.12.2018 в 10:00;29.12.2018 в 10:05;СПБГБУЗ «Городская поликлиника №86», г. СПб;Оказание услуг доступа к сети интернет с неограниченным объемом информации для СПб ГБУЗ «Городская поликлиника №86» в 2019 году. Наша цена — 303 150,12 руб.;4 адреса по Санкт-Петербургу, 10 до 30 Мбит/с.;705 000,12;АО «Квантум»;303 150,12;57,00%;0,00;70500,01;25 262,51;12 мес
0817200000318015300;Закупка 44-ФЗ;ООО «РТС-тендер»;26.12.2018 в 07:00;29.12.2018 в 06:20;Министерство природных ресурсов и экологии Алтайского края, г. Барнаул;Оказание услуг по коллективному доступу к информационно-коммуникационной сети Интернет, 20 Мбит/с. Наша цена — 46 800,00 руб.;Алтайский край, г. Барнаул, ул. Чкалова, д.230;90 000,00;ПАО «Вымпел-Коммуникации»;9 000,00;90,00%;0,00;9000,00;750,00;12 мес
0372200118118000018;Закупка 44-ФЗ;бумажный вариант;09.01.2018в 13:00;09.01.2019 в 13:00;ГБДОУ детский сад №6 Красносельского района Санкт-Петербурга;Предоставление услуг связи выделенного доступа Интернет, 10 Мбит/с. Наша цена — 37 200,00 руб.;г. Санкт-Петербург, п. Володарский, ул. Урицкого, д.14, лит.А;39 600,00;АО «Квантум»;37 200,00;6,06%;0,00;0,00;3 100,00;12 мес
31807251255;Закупка 223-ФЗ;ЗАО «Сбербанк-АСТ»;26.12.2018 в 09:00;09.01.2019 в 10:00;ФГБУ «Национальный медицинский исследовательский центр кардиологии Министерства здравоохранения РФ, г. Москва;Оказание услуг по предоставлению доступа сети Интернет, 100 Мбит/с. Наша цена — 260 697,00 руб.;г. Москва, ул. 3-я Черепковская, д.15А;389 100,00;ПАО «МГТС»;68 092,50;82,50%;0,00;38910,00;5 674,38;12 мес
0813500000118008775;Закупка 44-ФЗ;ООО «РТС-тендер»;10.01.2018 в 08:00;14.01.2019 в 08:15;ГУ Удмуртской республики «Служба гражданской защиты «Удмуртской Республики», г. Ижевск;Оказание услуг по доступу Интернет на Песочной, 17, 50 Мбит/с. Наша цена — 16 200,00 руб.;Республика Удмуртия, г. Ижевск, ул. Песочная, д.17;120 000,00;ПАО «Мегафон»;15 600,00;87,00%;0,00;12000,00;1 418,18;11 мес
ZK18122900004;Закупка 223-ФЗ;АГЗ РТ;29.12.2018 в 08:00;29.12.2018;МАУДО  г. Набережные Челны «Детско-юношеская спортивная школа «Заря», г. Набережные Челны;Оказание услуг по предоставлению доступа к сети Интернет, 3 Мбит/с. Наша цена — 29 800,00 руб. ;РТ, г. Набережные Челны, пр. Казанский, д.1, корп.4;33 169,44;АО «Квантум»;29 800,00;10,16%;391,40;391,40;2 483,33;12 мес
0130300032618000226;Закупка 44-ФЗ;РТС-тендер;28.12.2018 в 16:00;09.01.2019 в 09:25;Администрация города Вологды, г. Вологда;Услуги по предоставлению виртуального выделенного канала Ethernet, 80 Мбит/с. Наша цена — 143 913,00 руб.;г. Вологда, ул. Каменный мост, д.4, каб.№47 (серверная), г. Вологда, ул. Марии Ульяновой, д.6а, каб.№104 (серверная);323 400,00;ПАО «МТС»;116 424,00;64,00%;0,00;32340,00;10 123,83;11,5 мес
0130300032618000225;Закупка 44-ФЗ;РТС-тендер;28.12.2018 в 16:00;09.01.2019 в 09:20;Администрация города Вологды, г. Вологда;Услуги по предоставлению виртуального выделенного канала Ethernet, 70 Мбит/с. Наша цена — 91 390,20 руб.;г. Вологда, ул. Каменный мост, д.4, каб.№47 (серверная), г. Вологда, ул. Марии Ульяновой, д.6а, каб.№104 (серверная);299 640,00;ПАО «МТС»;89 892,00;70,00%;0,00;29964,00;7 816,70;11,5 мес
0130200002418003906;Закупка 44-ФЗ;РТС-тендер;28.12.2018 в 08:00;09.01.2019 в 11:25;БУ в сфере информационных технологий Вологодской области «ЦИТ», г. Вологда;Оказание услуг по предоставлению канала доступа к виртуальным частным cетям (VPN), 30 Мбит/с. Наша цена — 200 520,45 руб.;"2 канала связи: г. Вологда, ул. Герцена, д.2 — г. Москва, ул. Староконюшенный пер., д.4; г. Вологда, ул. Герцена, д.2 — г. Санкт-Петербург, Невский пр-т, д.151, оф.9";342 770,00;ПАО «Мегафон»;198 806,60;42,00%;0,00;34277,00;17 287,53;11,5 мес
0355300100618000098;Закупка 44-ФЗ;ЭТП НЭП;28.12.2018 в 09:00;09.01.2019 в 09:30;Администрация Бессоновского района — Местная администрация, г. Пенза;Оказание услуг по предоставлению доступа к сети Интернет и услуги VPN. Наша цена — 98 700,00 руб. Аукцион не состоялся всех участников отклонили. АО «Квантум» отклонили так как в Согласии не было прописано Тех.Задания по товару. Будем писать жалобу.;1. Пензенская обл, с. Бессоновка, ул. Коммунистическая, д.2 от 2 до  6 Мбит/с, VPN L3 — 10 Мбит/с.;277 272,00;отклонены все участники;нет победителей;нет победителей;0,00;13863,60;нет победителей;11,5 мес
0832200000118000245;Закупка 44-ФЗ;ЭТП НЭП;14.01.2019 в 09:00;18.01.2019 в 11:30;ГКУ Нижегородской области «Управление по делам гражданской обороны, чрезвычайным ситуациям и пожарной безопасности Нижегородской области», г. Нижний Новгород;Оказание услуг по предоставлению канала доступа к виртуальным частным сетям (VPN). Наша цена — 68 200,00 руб. действующий клиент.;6 адресов подключения по Нижегородской области, 1 Мбит/с.;220 000,00;АО «Квантум»;67 100,00;69,50%;0,00;55000,00;6 100,00;11 мес
0373100113318000061;Закупка 44-ФЗ;ЗАО «Сбербанк-АСТ»;09.01.2019 в 09:00;14.01.2019 в 09:20;ФГБУ «Центр управления имуществом агропромышленного комплекса РФ», г. Москва;Услуги местной, внутризоновой и междугородной телефонной связи, доступа к сети Интернет, 50 Мбит/с. Наша согласованная цена — 220 000,00 руб. Клиент действующий. Выиграли по максимальной цене, так как торги не состоялись — подана была всего одна заявка.;г. Москва, Ленинский пр., д.7А;387 082,66;АО «Квантум»;387 079,00;0,00%;0,00;38708,27;35 189,00;11 мес
31807354109;Закупка 223-ФЗ;"ООО ""РТС-тендер""";10.01.2019 в 08:00;14.01.2019 в 08:00;"ФГП ""Ведомственная охрана железнодорожного транспорта РФ"", г. Ульяновск";Оказание услуг по широкополосному доступу к сети Интернет, 5 Мбит/с. Наша цена — 169 837,92 руб.;г. Ульяновск — 4 адреса подключения по 5 Мбит/с.;195 216,00;АО «ЭР-Телеком Холдинг»;168 861,84;13,50%;7800,00;14712,00;14 071,82;12 мес
0217100000818000073;Закупка 44-ФЗ;ЗАО «Сбербанк-АСТ»;10.01.2019 в 09:00;10.01.2019 в 09:00;Территориальный фонд обязательного медицинского страхования Алтайского края, г. Барнаул;Оказание услуг по предоставлению доступа к сети Интернет (резервный канал), 2 Мбит/с. Наша цена — 8 400,00 руб.;Алтайский край, г. Барнаул, пр-т, Красноармейский, д.72;24 000,00;ПАО «Мобильные ТелеСистемы»;7 761,60;67,66%;0,00;0,00;646,80;12 мес
0358300002618000072;Закупка 44-ФЗ;"ООО ""РТС-тендер""";09.01.2019 в 11:00;14.01.2019 в 11:35;МБУЗ «Детская городская поликлиника № 45 города Ростова-на-Дону», г. Ростов-на-Дону;Услуги по предоставлению доступа к сети Интернет, 10 Мбит/с. Наша цена — 92 362, 24 руб.;г. Ростов-на-Дону, пр. Коммунистический, д.39, пр. М.Жукова, д.32, ул. Зорге — 72/1 — три адреса по 10 Мбит/с.;452 759,76;ПАО «Ростелеком»;90 098,24;80,10%;0,00;22637,99;8 190,75;11 мес
0817200000318015774;Закупка 44-ФЗ;"ООО ""РТС-тендер""";10.01.2019 в 07:00;14.01.2019 в 07:00;Министерство природных ресурсов и экологии Алтайского края», г. Барнаул;Оказание услуг внутризоновой телефонной связи, Поток Е1, 100 номеров Наша цена — 125 428,50 руб.;Алтайский край, г. Барнаул, ул. Чкалова, д.230;153 900,00;ПАО «Вымпел-Коммуникации»;107 730,00;30,00%;0,00;15390,00;9 793,64;11 мес
ZK19010900013;Закупка 223-ФЗ;АГЗ РТ;09.01.2019 в 08:00;09.01.2019 в 09:00;МАДОУ «Детский сад №107 «Салават купере», г. Набережные Челны;Оказание услуг по передаче данных и телематических услуг связи, 2 Мбит/с. Наша цена — 19 800,00 руб.;РТ, г. Набережные Челны, ул. Нур Баян, д.19;24 000,00;АО «Квантум»;19 800,00;17,50%;283,20;283,20;1 650,00;12 мес
ZK19011100004;Закупка 223-ФЗ;АГЗ РТ;11.01.2019 в 08:00;11.01.2019 в 08:00;МБДОУ «Детский сад комбинированного вида №14 «Зернышко», г. Набережные Челны;Оказание услуги по связи по передаче данных и телематических услуг связи (Интернет), 2 Мбит/с. Наша цена — 21 900,00 руб.;РТ, г. Набережные Челны, ул. Шамиля Усманова, д.98;22 935,60;АО «ЭР-Телеком Холдинг»;21 350,00;6,91%;270,64;270,64;1 856,52;11,5 мес
ZK19011100003;Закупка 223-ФЗ;АГЗ РТ;11.01.2019 в 08:00;11.01.2019 в 08:00;МБДОУ «Детский сад комбинированного вида №36 «Золотой ключик», г. Набережные Челны;Оказание услуги  связи по передаче данных и телематических услуг связи, 2 Мбит/с. Наша цена — 22 800,00 руб.;РТ, г. Набережные Челны, бульвар Строителей, д. 11 (6/09);24 560,04;ПАО «Мобильные ТелеСистемы»;18 000,00;26,71%;289,81;289,81;1 565,22;11,5 мес
ZK19011000012;Закупка 223-ФЗ;АГЗ РТ;10.01.2019 в 08:00;10.01.2019 в 08:00;МАДОУ «Детский сад №102 «Созвездие», г. Набережные Челны;Оказание услуг по предоставлению доступа к информационно-коммуникационной сети Интернет, 3 Мбит/с. Наша цена — 30 000,00 руб.;РТ, г. Набережные Челны, бульвар Строителей, д.16;31 599,96;ПАО «Мобильные ТелеСистемы»;24 000,00;24,05%;327,88;327,88;2 086,96;11,5 мес
0130300032618000227;Закупка 44-ФЗ;"ООО ""РТС-тендер""";11.01.2019 в 16:00;17.01.2019 в 12:00;Администрация города Вологды, г. Вологда;Услуги по предоставлению виртуального выделенного канала Ethernet, 50 Мбит/с. Наша цена — 13 926,36 руб.;г. Вологда, ул. Козленская, д.6, каб.518;198 948,00;ПАО «Мегафон»;13 926,36;93,00%;0,00;9947,40;1 266,03;11 мес
0358100035818000087;Закупка 44-ФЗ;ЗАО «Сбербанк-АСТ»;10.01.2019 в 10:00;14.01.2019 в 11:35;ГУ  Министерства РФ по делам ГО, ЧС и ликвидации последствий стихийных бедствий по Ростовской области, г. Ростов-на-Дону;Услуги доступа к сети «Интернет» для подразделений федеральной противопожарной службы по Ростовской области, 2 Мбит/с. Наша цена — 940 309,67 руб.;51 адрес по Ростовской области и городу на скорости 2 Мбит/с., 10 адресов по 4 Мбит/с.;1 504 495,67;ПАО «Ростелеком»;932 787,19;38,00%;15044,96;75224,78;84 798,84;11 мес
0111300000818001899;Закупка 44-ФЗ;АГЗ РТ;11.01.2019 а 07:00;14.01.2019 в 11:10;МАУДО  г. Набережные Челны «Детско-юношеская спортивная школа «Дельфин», г. Набережные Челны;Оказание услуг по предоставлению доступа к сети Интернет, 10 000 Кбит/с. Орлов М.В. принял решение не участвовать в закупке, т. к. по результатам ТО нет ТВ подключить клиента.;РТ, г. Набережные Челны, ул Набережная, им. Габдуллы Тукая, д.12, пр-т Хасана Туфана, д.3Е;183 199,92;АО «ЭР-Телеком Холдинг»;182 283,92;0,50%;0,00;9160,00;16 571,27;11 мес
0111300000818001900;Закупка 44-ФЗ;АГЗ РТ;11.01.2019 в 07:00;14.01.2019 в 11:25;МАДОУ г. Набережные Челны «Детский сад общеразвивающего вида с приоритетным осуществлением деятельности по познавательно-речевому направлению развития воспитанников №108 «Счастливое детство», г. Набережные Челны;Оказание услуги по предоставлению доступа к сети Интернет, 5 Мбит/с. Наша цена — 45 376,66 руб.;РТ, г. Набережные Челны, ул. Аделя Кутуя, д.4;83 259,96;АО «Квантум»;45 376,66;45,50%;0,00;4163,00;4 125,15;11 мес
0855200000518004531;Закупка 44-ФЗ;ЗАО «Сбербанк-АСТ»;11.01.2019 в 10:00;14.01.2019 в 12:15;ГБУ Пензенской области «Государственная кадастровая оценка», г. Пенза;Оказание услуг по предоставлению доступа к сети «Интернет», 10 Мбит/с. Наша цена — 26 836,40 руб.;г. Пенза, ул. Некрасова, д.26 — 10 Мбит/с.;64 800,00;ПАО «Ростелеком»;9 988,40;84,59%;0,00;6480,00;908,04;11 мес
0832200000118000249;Закупка 44-ФЗ;ЭТП НЭП;14.01.2019 в 09:00;18.01.2019 в 10:30;ГКУ Нижегородской области «Управление по делам гражданской обороны, чрезвычайным ситуациям и пожарной безопасности Нижегородской области», г. Нижний Новгород;Услуги по доступу к информационно-коммуникационной сети Интернет, 1 Мбит/с. Наша цена  -230 175,00 руб.;20 адресов по Нижегородской области по 1 Мбит/с, 1 адрес по 2 Мбит/с.;495 000,00;ПАО «Ростелеком»;227 700,00;54,00%;0,00;123750,00;20 700,00;11 мес
0362100010118000049;Закупка 44-ФЗ;ЗАО «Сбербанк-АСТ»;15.01.2019 в 08:00;18.01.2019 в 09:30;Экспертно-криминалистическая служба-региональный филиал Центрального экспертно-криминалистического таможенного управления г. Екатеринбург;Услуги по предоставлению доступа к сети Интернет, 10 Мбит/с. Наша цена — 36 853,214 руб.;г. Екатеринбург, ул. Завокзальная, д.40 (3-ий этаж);130 488,00;ЗАО «Уральское Ведомство Электронных Сообщений»;29 023,93;77,76%;0,00;6524,40;2 638,54;11 мес
ZK19011700005;Закупка 223-ФЗ;АГЗ РТ;18.01.2019 в 08:00;18.01.2019 В 08:00;МАУК «ДК «Энергетик», г. Набережные Челны;Оказание услуги по техническому обслуживанию охранного видеонаблюдения. Наша цена —38 556,00 руб.;РТ, г. Набережные Челны, наб. им. Габдуллы Тукая, д. 31;42 716,63;АО «Квантум»;38 556,00;9,74%;512,60;512,60;3 505,09;11 мес
ZK19011500005;Закупка 223-ФЗ;АГЗ РТ;15.01.2019 в 08:00;15.01.2019 в 08:00;МБУ «ЦПМСС №85», г. Набережные Челны;Оказание услуг по предоставлению доступа к сети Интернет, 2000 Кбит/с. Наша цена — 27 600,00 руб.;423821, РТ, г. Набережные Челны, пр-т Московский, д.100;29 000,04;ПАО «Таттелеком»;18 360,00;36,69%;348,00;348,00;1 530,00;12 мес
