Номер;Тип;Площадка;Срок;Начало аукциона;Заказчик\Владелец;Название;Регион;Цена лота;Победитель;Цена победителя;% изменения цены;Обеспечение заявки;Обеспечение контракта;Ежемесячная аб.плата;Срок контракта
0169300038719000004;Закупка 44-ФЗ;АО «ЕЭТП» roseltorg;17.01.2019 в 10:10;17.01.2019 в 10:10;Администрация Ашинского Муниципального района ;Услуги по предоставлению доступа к сети Интернет, 3 Мбит/с. Наша цена — 46 200,00 руб.;Челябинская обл., г. Аша, ул. Ленина, д.36;49 375,37;АО «Квантум»;46 200,00;6,43%;0,00;0,00;4 200,00;11 мес
ZK19011700004;Закупка 223-ФЗ;АГЗ РТ;17.01.2019 в 08:00;17.01.2019 в 08:00;МАУК «ДК «Энергетик», г. Набережные Челны;Оказание услуги по техническому обслуживанию охранного видеонаблюдения. Наша цена — 29 400,00 руб.;РТ, г. Набережные Челны, наб. им. Габдуллы Тукая, д. 31;32 237,40;ИП Алаев М.Н.;17 160,00;46,77%;386,85;386,85;1 492,17;11,5 мес
7500261900007;Закупка 44-ФЗ;Сайт Вологодского Правительства;18.01.2019 в 17:00;18.01.2019 в 17:00;МБУК «Объединение библиотек», г. Череповец;Предоставление телекоммуникационных услуг связи, 10 Мбит/с. Наша цена — 59 400,00 руб.;Вологодская область, г. Череповец, бульвар Доменщиков, д.32;70 000,00;АО «Квантум»;59 400,00;15,14%;0,00;0,00;5 400,00;11 мес
ZK19012200002;Закупка 44-ФЗ;АГЗ РТ;22.01.2019 в 00:00;22.01.2019 в 00:00;МАУК «Камерный оркестр Игоря Лермана», г. Набережные Челны;Оказание услуг по предоставлению доступа к сети Интернет, 7168 Мбит/с. Наша цена -50 400,00 руб.;РТ, г. Набережные Челны, Набережная имени Габдуллы Тукая, д.31;86 599,92;АО «Квантум»;50 400,00;41,80%;1039,20;1039,20;4 200,00;12 мес
7000641900003;Закупка 44-ФЗ;Сайт Вологодского Правительства;18.01.2019 в 12:00;19.01.2019 в 17:00;МОУ «Средняя общеобразовательная школа №4», г. Вологда;Оказание услуг связи (городская станционарная связь, внутризоновая и междугородняя связь, доступ в сеть Интернет), 10 Мбит/с. Наша цена — 98 890,00 руб.;г. Вологда, Советский пр., д.120;98 890,00;ПАО «Ростелеком»;75 000,00;24,16%;0,00;0,00;6 818,18;11 мес
1148260;Закупка 223-ФЗ;B2B.ru;20.12.2018 в 15:00;20.12.2018 в 15:00;ПАО «Татнефть», г. Казань;Предоставление услуг передачи данных для ПАО «Татнефть» (телефония, Интернет), 30 соед.линий с возможностью расширения до 60, по запросу заказчика. 50 местных номеров в г. Казань АВСх=843 с расширением до 100 номеров по заявке заказчика. Интернет от 10 до 100 мбит/с с минимальным шагом изменения 10 Мбит/с.;РТ, г. Казань, ул. Татарстан, д.14, ул. Оренбургский тракта, д.5д;без цены;АО «Квантум»;2 415 960,00;0,00%;0,00;0,00;67 110,00;36 мес
31907418317;Закупка 223-ФЗ;"ООО ""РТС-тендер""";24.01.2019 в 06:00;28.01.2019 в 11:00;АО «Научно-производственный центр «Полюс», г. Томск;Оказание услуг доступа к информационно-коммуникационной сети Интернет, 20 Мбит/с. Наша цена — 69 300,00 руб.;г. Томск, пр. Кирова, д.56 в;85 366,67;ООО «Зап-СибТрансТелеком»;65 010,00;26,85%;0,00;0,00;5 910,00;11 мес
0321200007819000002;Закупка 44-ФЗ;АО «ЕЭТП» roseltorg;24.01.2019 в 09:00;28.01.2019 в 11:33;ГКУ «Центр занятости населения города Ставрополя», г. Ставрополь;Услуги местной телефонной связи, 25 тел.номеров в коде (8652). Наша цена — 126 374,78 руб. Изначально была согласована цена — 89 342,00 руб. Ростелеком вышел на переговоры с Пика Р.С., решили сделать всего 1 шаг, а Ростелеком будет должен.;г. Ставрополь, пр-т Карла Маркса, 92 б;127 651,30;ПАО «Ростелеком»;126 374,78;1,00%;0,00;25530,26;11 488,62;11 мес
581137;Закупка 44-ФЗ;"ООО ""РТС-тендер""";25.01.2019 в 09:00;25.01.2019 в 10:00;МБУ «Редакция газеты «Городские известия», г. Курск;Оказание телематических услуг связи, 7 Мбит/с. Наша цена — 34 965,00 руб.;г. Курск, ул. Ленина, д.77а;36 135,00;ООО «Совтест-Интернет»;11 200,00;69,01%;0,00;0,00;1 018,18;11 мес
7000931900001;Закупка 44-ФЗ;Сайт Вологодского Правительства;27.01.2019 в 17:00;27.01.2019 в 17:00;МОУ «Средняя общеобразовательная школа с углубленным изучением отдельных предметов №8, г. Вологда;Оказание услуг связи (доступ в Интернет), 35 Мбит/с. Наша цена — 92 400,00 руб.;г. Вологда, ул. Мира, д.56;92 400,00;ПАО «Ростелеком»;68 200,00;26,19%;0,00;0,00;6 200,00;11 мес
7001011900001;Закупка 44-ФЗ;Сайт Вологодского Правительства;28.01.2019 в 17:00;28.01.2019 в 17:00;МОУ «Средняя общеобразовательная школа №35 им. Летчика-космонавта Героя Советского Союза П.И. Беляева, г. Вологда;Услуги связи. Интернет - 6 Мбит/с, телефония — 6 линий с тел.номерами. Наша цена — 62 700,00 руб.;г. Вологда, ул. Болонина, д.32;68 712,60;АО «Квантум»;62 700,00;8,75%;0,00;0,00;5 700,00;11 мес
0158200002319000002;Закупка 44-ФЗ;ЗАО «Сбербанк-АСТ»;25.01.2019 в 10:00;28.01.2019 в 10:05;Региональная служба государственного строительного надзора Ростовской области, г. Ростов-на-Дону;Услуги по доступу к информационно-коммуникационной сети Интернет. Наша цена  -  197 862,90 руб.;10 точек по Ростовской области  от 1 Мбит/с до 5 Мбит/с.;435 316,20;ПАО «Ростелеком»;195 686,32;55,05%;0,00;21765,81;17 789,67;11 мес
